Ratings,Comments
5,
5,"güvenili ve sorunsuz bir alışveriş oldu, hızlı kargo için teşekkürler"
5,Ürün fiyat performans olarak oldukça uygun. Kamerası ve işlemci hızı oldukça iyi. Satıcının ürünle birlikte hediye olarak gönderdiği ekran koruyucu kırılmış vaziyette ulaştı. Bu olumsuzluğun dışında memnunum. Hepsi burada'ya teşekkür ederim
5,Telefon tam bir fiyat performans ürünü çok sevdim iyi ki almışım satıcıya da teşekkürler güvenle satın alabilirsiniz sapasağlam orijinal ürün geldi.
5,Bu fiyata bu ürün hakkıdır.Tavsiye ederim.Cok güzel paket yapılmıştı ve kısa sürede ulaştırıldı
5,Ürün çok kaliteli. Saticı mükemmel.kargo hızlı. Daha ne olsun.herkese teşekkürler.
5,Anneme aldım sonra iki haftaya kalmadı babama da aldım ikisi de memnunlar.
5,"Fazla para harcamaya hiç gerek yok. Kesinlik f/p ürünü. Kamera, işlemci ve Android 11 sürümü ile adeta uçuyor."
5,Kardeşime aldım çok beğendi fiyat performans ürünü çok da bir şey bekleyin.
5,Tavsiye ederim
5,Cihaz kargo hızlı. Güvenilir satıcı.
5,hızlı kargo iyi satıcı
5,İstenilen bir cihaz parasına göre çok iyi
5,Annem ve babama 2 tane aldim. Gayet memmunlar
5,Bu fiyata alınabilecek mükemmel bir marka ve ürün
5,Çok güzel mükemmel uygun
5,Ürün çok güzel. Babama aldık çok beğendi.
5,Ürün on numara hepsiburada ya teşekkürler :)
5,Gayet iyi bu fiyata
5,fiyata vire güzel tekefon
